{
  "recordId": "HDIP-CLA-A9-07-EXTERNAL_BOUNDARY_CONTRACT_DECLARATION",
  "version": "0.1",
  "scope": "Illustrative Governing Revocation During Active Operation; non-normative and NOT_ASSESSED",
  "sourceAuthority": "HDIP-CLA-0.1-M17",
  "boundaryFamilyIds": [
    "HDIP-BND-05"
  ],
  "boundaryInstanceRef": "EXAMPLE-DOWNSTREAM",
  "interactionContractRef": "EXAMPLE-INT-CONTRACT",
  "externalAuthorityRefs": [
    "EXAMPLE-DECISION-AUTHORITY"
  ],
  "accessAuthorizationDistinctFromConsequenceAuthorization": true,
  "notAnAPIOrLegalContractByDefinition": true
}
